{
  "$schema": "https://json-schema.org/draft/2020-12/schema",
  "$id": "https://github.com/durable-workflow/.github/blob/main/candidates/verification-schema.json",
  "title": "Durable Workflow beta candidate verification",
  "type": "object",
  "additionalProperties": false,
  "required": ["schema", "candidate", "manifest_sha256", "verified_at", "outcome", "components"],
  "properties": {
    "schema": {"const": "durable-workflow.beta-candidate-verification/v2"},
    "candidate": {"type": "string", "pattern": "^[a-z0-9][a-z0-9._-]{0,62}$"},
    "manifest_sha256": {"$ref": "#/$defs/sha256"},
    "verified_at": {
      "type": "string",
      "pattern": "^[0-9]{4}-[0-9]{2}-[0-9]{2}T[0-9]{2}:[0-9]{2}:[0-9]{2}Z$"
    },
    "outcome": {"const": "verified"},
    "components": {
      "type": "object",
      "additionalProperties": false,
      "required": ["workflow", "waterline", "server", "cli", "sdk-php", "sdk-python", "sdk-rust"],
      "properties": {
        "workflow": {"$ref": "#/$defs/composerResult"},
        "waterline": {"$ref": "#/$defs/waterlineResult"},
        "server": {"$ref": "#/$defs/ociResult"},
        "cli": {"$ref": "#/$defs/githubReleaseResult"},
        "sdk-php": {"$ref": "#/$defs/composerResult"},
        "sdk-python": {"$ref": "#/$defs/pypiResult"},
        "sdk-rust": {"$ref": "#/$defs/crateResult"}
      }
    }
  },
  "$defs": {
    "sha256": {"type": "string", "pattern": "^[0-9a-f]{64}$"},
    "commit": {"type": "string", "pattern": "^[0-9a-f]{40}$"},
    "ociDigest": {"type": "string", "pattern": "^sha256:[0-9a-f]{64}$"},
    "version": {
      "type": "string",
      "pattern": "^[0-9]+\\.[0-9]+\\.[0-9]+(?:[-+][0-9A-Za-z][0-9A-Za-z.-]*)?$"
    },
    "httpsUrl": {
      "type": "string",
      "format": "uri",
      "pattern": "^https://",
      "maxLength": 2048
    },
    "download": {
      "type": "object",
      "additionalProperties": false,
      "required": ["url", "size", "sha256"],
      "properties": {
        "url": {"$ref": "#/$defs/httpsUrl"},
        "size": {"type": "integer", "minimum": 1, "maximum": 9223372036854775807},
        "sha256": {"$ref": "#/$defs/sha256"}
      }
    },
    "source": {
      "type": "object",
      "additionalProperties": false,
      "required": ["repository", "tag", "tag_object", "commit", "url"],
      "properties": {
        "repository": {"type": "string", "pattern": "^durable-workflow/[a-z0-9-]{1,64}$"},
        "tag": {"$ref": "#/$defs/version"},
        "tag_object": {"$ref": "#/$defs/commit"},
        "commit": {"$ref": "#/$defs/commit"},
        "url": {"$ref": "#/$defs/httpsUrl"}
      }
    },
    "composerDistribution": {
      "type": "object",
      "additionalProperties": false,
      "required": ["kind", "package", "registry", "source_reference", "dist_reference", "dist"],
      "properties": {
        "kind": {"const": "composer"},
        "package": {"type": "string", "minLength": 1, "maxLength": 128},
        "registry": {"$ref": "#/$defs/httpsUrl"},
        "source_reference": {"$ref": "#/$defs/commit"},
        "dist_reference": {"$ref": "#/$defs/commit"},
        "dist": {"$ref": "#/$defs/download"}
      }
    },
    "attestationAuthority": {
      "oneOf": [
        {
          "type": "object",
          "additionalProperties": false,
          "required": ["mode", "ref", "commit"],
          "properties": {
            "mode": {"const": "exact-tag"},
            "ref": {"type": "string", "pattern": "^refs/tags/", "maxLength": 256},
            "commit": {"$ref": "#/$defs/commit"}
          }
        },
        {
          "type": "object",
          "additionalProperties": false,
          "required": ["mode", "ref", "workflow"],
          "properties": {
            "mode": {"const": "qualified-main-workflow"},
            "ref": {"const": "refs/heads/main"},
            "workflow": {
              "type": "string",
              "pattern": "^durable-workflow/cli/\\.github/workflows/release\\.yml$"
            }
          }
        }
      ]
    },
    "releaseAsset": {
      "type": "object",
      "additionalProperties": false,
      "required": ["name", "asset_id", "url", "size", "sha256"],
      "properties": {
        "name": {
          "enum": [
            "SHA256SUMS",
            "dw-linux-aarch64",
            "dw-linux-x86_64",
            "dw-macos-aarch64",
            "dw-windows-x86_64.exe",
            "dw.phar",
            "dw.rb",
            "install.ps1",
            "install.sh",
            "verify-release.sh"
          ]
        },
        "asset_id": {"type": "integer", "minimum": 1, "maximum": 9223372036854775807},
        "url": {"$ref": "#/$defs/httpsUrl"},
        "size": {"type": "integer", "minimum": 1, "maximum": 9223372036854775807},
        "sha256": {"$ref": "#/$defs/sha256"}
      }
    },
    "githubReleaseDistribution": {
      "type": "object",
      "additionalProperties": false,
      "required": [
        "kind",
        "repository",
        "release_id",
        "release_url",
        "build_attestations_verified",
        "build_attestation_authority",
        "package_source",
        "assets"
      ],
      "properties": {
        "kind": {"const": "github-release"},
        "repository": {"const": "durable-workflow/cli"},
        "release_id": {"type": "integer", "minimum": 1, "maximum": 9223372036854775807},
        "release_url": {"$ref": "#/$defs/httpsUrl"},
        "build_attestations_verified": {"const": true},
        "build_attestation_authority": {"$ref": "#/$defs/attestationAuthority"},
        "package_source": {
          "type": "object",
          "additionalProperties": false,
          "required": ["commit", "embedded_phar_identity"],
          "properties": {
            "commit": {"$ref": "#/$defs/commit"},
            "embedded_phar_identity": {
              "type": "string",
              "pattern": "^dw [0-9]+\\.[0-9]+\\.[0-9]+(?:[-+][0-9A-Za-z][0-9A-Za-z.-]*)? \\(commit [0-9a-f]{12}\\)$",
              "maxLength": 512
            }
          }
        },
        "assets": {
          "type": "array",
          "minItems": 10,
          "maxItems": 10,
          "uniqueItems": true,
          "items": {"$ref": "#/$defs/releaseAsset"}
        }
      }
    },
    "pypiFile": {
      "type": "object",
      "additionalProperties": false,
      "required": ["filename", "package_type", "url", "size", "sha256"],
      "properties": {
        "filename": {"type": "string", "minLength": 1, "maxLength": 255, "pattern": "^[^/\\\\]+$"},
        "package_type": {"enum": ["bdist_wheel", "sdist"]},
        "url": {"$ref": "#/$defs/httpsUrl"},
        "size": {"type": "integer", "minimum": 1, "maximum": 9223372036854775807},
        "sha256": {"$ref": "#/$defs/sha256"}
      }
    },
    "pypiDistribution": {
      "type": "object",
      "additionalProperties": false,
      "required": ["kind", "package", "registry", "source_identity", "files"],
      "properties": {
        "kind": {"const": "pypi"},
        "package": {"const": "durable-workflow"},
        "registry": {"$ref": "#/$defs/httpsUrl"},
        "source_identity": {
          "type": "object",
          "additionalProperties": false,
          "required": ["source_archive", "source_files_compared", "wheel_files_compared", "source_commit"],
          "properties": {
            "source_archive": {"$ref": "#/$defs/download"},
            "source_files_compared": {"type": "integer", "minimum": 1, "maximum": 9223372036854775807},
            "wheel_files_compared": {"type": "integer", "minimum": 1, "maximum": 9223372036854775807},
            "source_commit": {"$ref": "#/$defs/commit"}
          }
        },
        "files": {
          "type": "array",
          "minItems": 2,
          "maxItems": 32,
          "uniqueItems": true,
          "items": {"$ref": "#/$defs/pypiFile"}
        }
      }
    },
    "crateDistribution": {
      "type": "object",
      "additionalProperties": false,
      "required": ["kind", "package", "registry", "archive_vcs_commit", "archive_vcs_dirty", "archive"],
      "properties": {
        "kind": {"const": "crates.io"},
        "package": {"const": "durable-workflow"},
        "registry": {"$ref": "#/$defs/httpsUrl"},
        "archive_vcs_commit": {"$ref": "#/$defs/commit"},
        "archive_vcs_dirty": {"const": false},
        "archive": {"$ref": "#/$defs/download"}
      }
    },
    "ociConfig": {
      "type": "object",
      "additionalProperties": false,
      "required": ["digest", "labels"],
      "properties": {
        "digest": {"$ref": "#/$defs/ociDigest"},
        "labels": {
          "type": "object",
          "additionalProperties": false,
          "required": ["org.opencontainers.image.revision", "dev.durable-workflow.release.tag"],
          "properties": {
            "org.opencontainers.image.revision": {"$ref": "#/$defs/commit"},
            "dev.durable-workflow.release.tag": {"$ref": "#/$defs/version"}
          }
        }
      }
    },
    "ociDistribution": {
      "type": "object",
      "additionalProperties": false,
      "required": ["kind", "image", "manifest_digest", "platforms", "configs"],
      "properties": {
        "kind": {"const": "oci"},
        "image": {"type": "string", "pattern": "^docker\\.io/durableworkflow/(?:server|waterline):"},
        "manifest_digest": {"$ref": "#/$defs/ociDigest"},
        "platforms": {
          "type": "array",
          "minItems": 2,
          "maxItems": 2,
          "uniqueItems": true,
          "items": {"enum": ["linux/amd64", "linux/arm64"]}
        },
        "configs": {
          "type": "array",
          "minItems": 2,
          "maxItems": 2,
          "uniqueItems": true,
          "items": {"$ref": "#/$defs/ociConfig"}
        }
      }
    },
    "serverOciDistribution": {
      "allOf": [
        {"$ref": "#/$defs/ociDistribution"},
        {
          "type": "object",
          "properties": {
            "image": {"type": "string", "pattern": "^docker\\.io/durableworkflow/server:"}
          }
        }
      ]
    },
    "waterlineOciDistribution": {
      "allOf": [
        {"$ref": "#/$defs/ociDistribution"},
        {
          "type": "object",
          "properties": {
            "image": {"type": "string", "pattern": "^docker\\.io/durableworkflow/waterline:"}
          }
        }
      ]
    },
    "resultBase": {
      "type": "object",
      "required": ["version", "commit", "source", "distribution", "outcome"],
      "properties": {
        "version": {"$ref": "#/$defs/version"},
        "commit": {"$ref": "#/$defs/commit"},
        "source": {"$ref": "#/$defs/source"},
        "outcome": {"const": "verified"}
      }
    },
    "composerResult": {
      "allOf": [
        {"$ref": "#/$defs/resultBase"},
        {
          "type": "object",
          "additionalProperties": false,
          "required": ["version", "commit", "source", "distribution", "outcome"],
          "properties": {
            "version": {"$ref": "#/$defs/version"},
            "commit": {"$ref": "#/$defs/commit"},
            "source": {"$ref": "#/$defs/source"},
            "distribution": {"$ref": "#/$defs/composerDistribution"},
            "outcome": {"const": "verified"}
          }
        }
      ]
    },
    "waterlineResult": {
      "allOf": [
        {
          "type": "object",
          "additionalProperties": false,
          "required": ["version", "commit", "source", "distributions", "outcome"],
          "properties": {
            "version": {"$ref": "#/$defs/version"},
            "commit": {"$ref": "#/$defs/commit"},
            "source": {"$ref": "#/$defs/source"},
            "distributions": {
              "type": "object",
              "additionalProperties": false,
              "required": ["embedded", "service"],
              "properties": {
                "embedded": {"$ref": "#/$defs/composerDistribution"},
                "service": {"$ref": "#/$defs/waterlineOciDistribution"}
              }
            },
            "outcome": {"const": "verified"}
          }
        }
      ]
    },
    "githubReleaseResult": {
      "allOf": [
        {"$ref": "#/$defs/resultBase"},
        {
          "type": "object",
          "additionalProperties": false,
          "required": ["version", "commit", "source", "distribution", "outcome"],
          "properties": {
            "version": {"$ref": "#/$defs/version"},
            "commit": {"$ref": "#/$defs/commit"},
            "source": {"$ref": "#/$defs/source"},
            "distribution": {"$ref": "#/$defs/githubReleaseDistribution"},
            "outcome": {"const": "verified"}
          }
        }
      ]
    },
    "pypiResult": {
      "allOf": [
        {"$ref": "#/$defs/resultBase"},
        {
          "type": "object",
          "additionalProperties": false,
          "required": ["version", "commit", "source", "distribution", "outcome"],
          "properties": {
            "version": {"$ref": "#/$defs/version"},
            "commit": {"$ref": "#/$defs/commit"},
            "source": {"$ref": "#/$defs/source"},
            "distribution": {"$ref": "#/$defs/pypiDistribution"},
            "outcome": {"const": "verified"}
          }
        }
      ]
    },
    "crateResult": {
      "allOf": [
        {"$ref": "#/$defs/resultBase"},
        {
          "type": "object",
          "additionalProperties": false,
          "required": ["version", "commit", "source", "distribution", "outcome"],
          "properties": {
            "version": {"$ref": "#/$defs/version"},
            "commit": {"$ref": "#/$defs/commit"},
            "source": {"$ref": "#/$defs/source"},
            "distribution": {"$ref": "#/$defs/crateDistribution"},
            "outcome": {"const": "verified"}
          }
        }
      ]
    },
    "ociResult": {
      "allOf": [
        {"$ref": "#/$defs/resultBase"},
        {
          "type": "object",
          "additionalProperties": false,
          "required": ["version", "commit", "source", "distribution", "outcome"],
          "properties": {
            "version": {"$ref": "#/$defs/version"},
            "commit": {"$ref": "#/$defs/commit"},
            "source": {"$ref": "#/$defs/source"},
            "distribution": {"$ref": "#/$defs/serverOciDistribution"},
            "outcome": {"const": "verified"}
          }
        }
      ]
    }
  }
}
